<?xml version="1.0" encoding="UTF-8"?>
<!DOCTYPE cluster SYSTEM "cluster.dtd">

<cluster status="OK" name="testCluster" masterHost="node1">
	<hosts>
		<host name="node1" type="MASTER" status="OK" />
		<host name="node2" type="SERVER" status="OK" />
		<host name="client1" type="CLIENT" status="OK" />
	</hosts>
	<jobGroups>
		<jobGroup name="default" />
	</jobGroups>
	<jobs>
		<job jobID="_1" state="RUNNING" submissionHost="client1" submissionTime="1351095690242" executionHost="node2" />
	</jobs>
</cluster>